{
  "id": "just_one_en_classic_v1",
  "name": "Classic English",
  "language": "en",
  "version": 1,
  "cards": [
    {
      "id": "en_0001",
      "words": [
        "Pixel",
        "Kindness",
        "Painter",
        "Roller Skating",
        "Rope"
      ]
    },
    {
      "id": "en_0002",
      "words": [
        "Electricity",
        "Parliament",
        "Alien",
        "Shredder",
        "Paragliding"
      ]
    },
    {
      "id": "en_0003",
      "words": [
        "Hedgehog",
        "Blanket",
        "Samurai",
        "Photographer",
        "Tea"
      ]
    },
    {
      "id": "en_0004",
      "words": [
        "Sahara",
        "Turtle",
        "Metronome",
        "Earthquake",
        "Trust"
      ]
    },
    {
      "id": "en_0005",
      "words": [
        "Pillow",
        "Explorer",
        "Airplane",
        "Infinity",
        "Radar"
      ]
    },
    {
      "id": "en_0006",
      "words": [
        "Martial Arts",
        "Bread",
        "Neutron",
        "Eiffel Tower",
        "Cartoon"
      ]
    },
    {
      "id": "en_0007",
      "words": [
        "Juggling",
        "Firefighter",
        "Paradox",
        "Mother",
        "Software"
      ]
    },
    {
      "id": "en_0008",
      "words": [
        "Time",
        "Guitar",
        "Pirate",
        "Waffle",
        "Supernova"
      ]
    },
    {
      "id": "en_0009",
      "words": [
        "Celebrity",
        "Helicopter",
        "Paris",
        "Feudalism",
        "Surprise"
      ]
    },
    {
      "id": "en_0010",
      "words": [
        "Lobster",
        "Utopia",
        "Chocolate",
        "Magnet",
        "Astronaut"
      ]
    },
    {
      "id": "en_0011",
      "words": [
        "Shark",
        "Empire",
        "Baker",
        "Novel",
        "Irony"
      ]
    },
    {
      "id": "en_0012",
      "words": [
        "Armadillo",
        "Colony",
        "Honesty",
        "Teacher",
        "Princess"
      ]
    },
    {
      "id": "en_0013",
      "words": [
        "Doppelganger",
        "Fear",
        "Dragon",
        "Programmer",
        "Sushi"
      ]
    },
    {
      "id": "en_0014",
      "words": [
        "Puppet",
        "Toothbrush",
        "Whale",
        "Detective",
        "Odyssey"
      ]
    },
    {
      "id": "en_0015",
      "words": [
        "Monsoon",
        "Sister",
        "Bus",
        "Burrito",
        "Gardening"
      ]
    },
    {
      "id": "en_0016",
      "words": [
        "Piranha",
        "Concert",
        "Banana",
        "Actor",
        "Glacier"
      ]
    },
    {
      "id": "en_0017",
      "words": [
        "Alchemist",
        "Family",
        "Hurricane",
        "Patience",
        "Suitcase"
      ]
    },
    {
      "id": "en_0018",
      "words": [
        "Democracy",
        "Koala",
        "Battery",
        "Beekeeper",
        "Neighbor"
      ]
    },
    {
      "id": "en_0019",
      "words": [
        "Escalator",
        "Frog",
        "Cold War",
        "Zombie",
        "Shoes"
      ]
    },
    {
      "id": "en_0020",
      "words": [
        "Popcorn",
        "Battlefield",
        "Owl",
        "Sculptor",
        "Teleportation"
      ]
    },
    {
      "id": "en_0021",
      "words": [
        "Monorail",
        "Saffron",
        "Queen",
        "Clock",
        "Spy"
      ]
    },
    {
      "id": "en_0022",
      "words": [
        "Asia",
        "Wi-Fi",
        "Encore",
        "Hourglass",
        "Bowling"
      ]
    },
    {
      "id": "en_0023",
      "words": [
        "Curtain",
        "Dream",
        "Waterfall",
        "Rocket",
        "Pendulum"
      ]
    },
    {
      "id": "en_0024",
      "words": [
        "Colleague",
        "Hope",
        "Corkscrew",
        "Dress",
        "Louvre"
      ]
    },
    {
      "id": "en_0025",
      "words": [
        "Whistle",
        "Honey",
        "Scorpion",
        "Baby",
        "Tide"
      ]
    },
    {
      "id": "en_0026",
      "words": [
        "Courage",
        "Compass",
        "Rival",
        "Galaxy",
        "Elephant"
      ]
    },
    {
      "id": "en_0027",
      "words": [
        "Subway",
        "Microphone",
        "Shame",
        "Dancer",
        "Squirrel"
      ]
    },
    {
      "id": "en_0028",
      "words": [
        "Driver",
        "Computer",
        "Snorkeling",
        "Déjà Vu",
        "Mustard"
      ]
    },
    {
      "id": "en_0029",
      "words": [
        "Gladiator",
        "Apron",
        "Everest",
        "Freedom",
        "Surfing"
      ]
    },
    {
      "id": "en_0030",
      "words": [
        "Avocado",
        "Notebook",
        "Theater",
        "Running",
        "Grand Canyon"
      ]
    },
    {
      "id": "en_0031",
      "words": [
        "Pole Vault",
        "Generation",
        "Vaccine",
        "Bucket",
        "Canoe"
      ]
    },
    {
      "id": "en_0032",
      "words": [
        "London",
        "Coral",
        "Basketball",
        "Cryptography",
        "Scientist"
      ]
    },
    {
      "id": "en_0033",
      "words": [
        "Star",
        "Blender",
        "Comedy",
        "Justice",
        "Brother"
      ]
    },
    {
      "id": "en_0034",
      "words": [
        "Mushroom",
        "Platypus",
        "Flag",
        "Laser",
        "Ginger"
      ]
    },
    {
      "id": "en_0035",
      "words": [
        "Volcano",
        "Peace",
        "Quantum",
        "Pyramid",
        "Puzzle"
      ]
    },
    {
      "id": "en_0036",
      "words": [
        "Spoon",
        "Brazil",
        "Tsunami",
        "Pottery",
        "Superhero"
      ]
    },
    {
      "id": "en_0037",
      "words": [
        "Rain",
        "Identity",
        "Hiking",
        "Jellyfish",
        "Doormat"
      ]
    },
    {
      "id": "en_0038",
      "words": [
        "Community",
        "Tennis",
        "Mechanic",
        "Hat",
        "3D Printing"
      ]
    },
    {
      "id": "en_0039",
      "words": [
        "Pepper",
        "Wardrobe",
        "Mirror",
        "Pebble",
        "Pilot"
      ]
    },
    {
      "id": "en_0040",
      "words": [
        "Train",
        "Omelet",
        "Empathy",
        "Reef",
        "Jeans"
      ]
    },
    {
      "id": "en_0041",
      "words": [
        "Scarf",
        "Croissant",
        "Ocean",
        "Mystery",
        "Museum"
      ]
    },
    {
      "id": "en_0042",
      "words": [
        "Origami",
        "Mythology",
        "Lantern",
        "Forest",
        "Couple"
      ]
    },
    {
      "id": "en_0043",
      "words": [
        "Typewriter",
        "Lion",
        "Mentor",
        "Apple",
        "Colosseum"
      ]
    },
    {
      "id": "en_0044",
      "words": [
        "Rice",
        "Surgeon",
        "Rabbit",
        "Sensor",
        "Tourist"
      ]
    },
    {
      "id": "en_0045",
      "words": [
        "Hawaii",
        "Swimming",
        "Unicycle",
        "Drought",
        "Circus"
      ]
    },
    {
      "id": "en_0046",
      "words": [
        "Confidence",
        "Masquerade",
        "Scooter",
        "Solar Panel",
        "Garlic"
      ]
    },
    {
      "id": "en_0047",
      "words": [
        "Avalanche",
        "Coffee",
        "Balance",
        "Octopus",
        "Umbrella"
      ]
    },
    {
      "id": "en_0048",
      "words": [
        "Opera",
        "Experiment",
        "Fencing",
        "Tractor",
        "Knight"
      ]
    },
    {
      "id": "en_0049",
      "words": [
        "Viking",
        "Genie",
        "Intuition",
        "Projector",
        "Friend"
      ]
    },
    {
      "id": "en_0050",
      "words": [
        "Referee",
        "Carrot",
        "Butterfly",
        "Atlantis",
        "Loyalty"
      ]
    },
    {
      "id": "en_0051",
      "words": [
        "Fireplace",
        "Monkey",
        "Pride",
        "Taj Mahal",
        "Fishing"
      ]
    },
    {
      "id": "en_0052",
      "words": [
        "Satellite",
        "Badminton",
        "Wizard",
        "Respect",
        "Thunder"
      ]
    },
    {
      "id": "en_0053",
      "words": [
        "Festival",
        "Baseball",
        "Africa",
        "Ambiguity",
        "Car"
      ]
    },
    {
      "id": "en_0054",
      "words": [
        "Joy",
        "Bed",
        "Architect",
        "Orphan",
        "Monster"
      ]
    },
    {
      "id": "en_0055",
      "words": [
        "Football",
        "Gondola",
        "Stopwatch",
        "Coconut",
        "Nephew"
      ]
    },
    {
      "id": "en_0056",
      "words": [
        "Bluetooth",
        "Truck",
        "Doctor",
        "Vacuum",
        "Renaissance"
      ]
    },
    {
      "id": "en_0057",
      "words": [
        "Archaeology",
        "Egypt",
        "Cycling",
        "Chaos",
        "Peacock"
      ]
    },
    {
      "id": "en_0058",
      "words": [
        "Taxi",
        "Fairy",
        "Darts",
        "Hieroglyph",
        "Chameleon"
      ]
    },
    {
      "id": "en_0059",
      "words": [
        "Cashier",
        "Gymnastics",
        "Globe",
        "Sphinx",
        "Key"
      ]
    },
    {
      "id": "en_0060",
      "words": [
        "Horse",
        "Engine",
        "Cinnamon",
        "Magic",
        "Lifeguard"
      ]
    },
    {
      "id": "en_0061",
      "words": [
        "Jet Ski",
        "Kangaroo",
        "Fondue",
        "Slippers",
        "Flashlight"
      ]
    },
    {
      "id": "en_0062",
      "words": [
        "Skiing",
        "Karaoke",
        "Bermuda Triangle",
        "Rickshaw",
        "Shirt"
      ]
    },
    {
      "id": "en_0063",
      "words": [
        "Vampire",
        "Island",
        "Serendipity",
        "Thermometer",
        "Circuit"
      ]
    },
    {
      "id": "en_0064",
      "words": [
        "Republic",
        "Flamingo",